{
  "schema": "fmea-mining.playbook-deepdives.v1",
  "version": "1.3.18",
  "editorialNature": "roteiros_propostos_para_playbooks_sinteticos_sem_eventos_reais",
  "mappingPolicy": "IDs dos playbooks originais e H1/H2/H3 sao preservados; caminhos causais e registros SAP nao sao associados sem prova.",
  "counts": {
    "playbooksInSource": 12,
    "newDeepdives": 6,
    "otherPlaybooksWithoutThisDeepDive": 6,
    "proposedStages": 18,
    "readinessRequirements": 24,
    "eventsObserved": 0,
    "causesConfirmed": 0
  },
  "otherPlaybookIds": [
    "PB-EXC-HOSE-01",
    "PB-SHOVEL-COOL-01",
    "PB-TRUCK-FINAL-01",
    "PB-DOZER-TRACK-01",
    "PB-EXC-PUMP-01",
    "PB-LOADER-RADIATOR-01"
  ],
  "records": [
    {
      "id": "DEEP-LOADER-CYL-001",
      "playbookId": "PB-LOADER-CYL-01",
      "sourcePlaybookVersion": "1.2.1",
      "originScenarioStatus": "cenario_autoral_sintetico",
      "system": "implementos_hidraulicos",
      "title": "Carregadeira CAT 980 — perda de posição do implemento",
      "modelIds": [
        "CAT980"
      ],
      "objective": "Distinguir perda externa, deriva por circuito interno e fuga de linha antes de atribuir defeito ao cilindro.",
      "hypotheses": [
        {
          "id": "H1",
          "label": "Vedação externa do cilindro com perda de estanqueidade",
          "expectedSigns": "Perda identificada junto à haste/junta",
          "counterSigns": "Exterior seco e perda localizada em outro ponto"
        },
        {
          "id": "H2",
          "label": "Vazamento interno do cilindro ou válvula de retenção",
          "expectedSigns": "Deriva mensurável sem perda externa e teste discriminante de circuito",
          "counterSigns": "Estanqueidade e retenção confirmadas por método OEM"
        },
        {
          "id": "H3",
          "label": "Fuga em mangueira ou conexão de alimentação",
          "expectedSigns": "Trilha de óleo inicia na linha/conexão",
          "counterSigns": "Conexões íntegras, origem localizada no cilindro"
        }
      ],
      "sourceTestIds": [
        "T1",
        "T2"
      ],
      "stages": [
        {
          "id": "S1",
          "methodId": "EV-01",
          "sourceTestId": "T1",
          "question": "Após sustentar mecanicamente o implemento e isolar energias, qual é a origem exata da trilha de óleo ao longo de haste, interfaces e linhas?",
          "signals": {
            "H1": "Fluido surgindo junto à vedação da haste favorece fuga externa do cilindro, sem demonstrar falha interna.",
            "H2": "Ausência de vazamento externo não prova retenção interna nem identifica qual válvula poderia falhar.",
            "H3": "Trilha começando na mangueira ou conexão de alimentação favorece fuga externa da linha."
          },
          "nonDiscrimination": "Óleo espalhado antes do isolamento ou superfície limpa sem registro de origem não permite atribuir a falha a nenhuma peça.",
          "requiredMetadata": [
            "equipmentContext",
            "dateTime",
            "isolationStatus",
            "implementMechanicalSupport",
            "inspectionLocation",
            "photographicTrace"
          ],
          "safeBoundary": "Nunca permanecer sob implemento sustentado apenas por hidráulica; descarregar pressão residual e seguir bloqueio e escoramento conforme OEM.",
          "performed": false,
          "resultObserved": null,
          "oemEffective": false,
          "independentEvidenceVerified": false
        },
        {
          "id": "S2",
          "methodId": "EV-12",
          "sourceTestId": "T2",
          "question": "Há deriva de posição mensurada em teste de retenção autorizado, separando condição da carga e arquitetura de válvulas do cilindro?",
          "signals": {
            "H1": "Se um vazamento externo documentado acompanha deriva, investigar relação causal sem pressupor uma única origem.",
            "H2": "Deriva persistente sem fuga externa reforça vazamento interno ou deficiência de retenção, mas não distingue esses componentes.",
            "H3": "Fuga documentada em linha sob condição comparável pode explicar deriva sem culpa do cilindro."
          },
          "nonDiscrimination": "A deriva isolada, sem isolamento correto do circuito e referência por arranjo, não distingue vedação interna de válvula ou linha.",
          "requiredMetadata": [
            "equipmentContext",
            "dateTime",
            "oemProcedureReference",
            "loadCondition",
            "isolationStatus",
            "positionTrend"
          ],
          "safeBoundary": "Não executar deriva deliberada com pessoas em alcance de esmagamento; ensaio apenas com suporte e procedimento OEM autorizado.",
          "performed": false,
          "resultObserved": null,
          "oemEffective": false,
          "independentEvidenceVerified": false
        },
        {
          "id": "S3",
          "methodId": "EV-05",
          "sourceTestId": null,
          "question": "A medição instrumentada por pontos OEM consegue separar perdas de pressão do cilindro, da válvula de retenção e da linha sem extrapolar limites?",
          "signals": {
            "H1": "Perda externa e ponto de fuga verificados orientam a condição da vedação externa, independentemente de retenção interna.",
            "H2": "Medição seletiva comparada ao esquema OEM pode favorecer circuito interno ou retenção, sujeita à contraprova específica.",
            "H3": "Queda entre pontos de linha associada a fuga localizada pode reforçar hipótese da alimentação."
          },
          "nonDiscrimination": "Pressões sem pontos efetivos, instrumento calibrado, carga e circuito isolado podem ser compatíveis com as três hipóteses.",
          "requiredMetadata": [
            "equipmentContext",
            "dateTime",
            "oemHydraulicSchematic",
            "measurementPorts",
            "instrumentCalibration",
            "loadCondition"
          ],
          "safeBoundary": "Não instalar instrumentos em circuito pressurizado ou abrir portas sem o procedimento específico e pessoal habilitado.",
          "performed": false,
          "resultObserved": null,
          "oemEffective": false,
          "independentEvidenceVerified": false
        }
      ],
      "readiness": {
        "requires": [
          "Identificação do cilindro, porta hidráulica, válvula associada e configuração OEM efetiva",
          "Registro de origem de óleo externo com fotos, posição e isolamento de energia",
          "Ensaio de deriva ou retenção com procedimento e condições controladas pelo fabricante",
          "Diagnóstico independente que separe vedação interna de válvula de retenção e linha de alimentação"
        ],
        "whenMissing": "inconclusivo",
        "whenComplete": "apto_para_revisao_nao_confirmado"
      },
      "sourceIds": [
        "CAT-HYD-HOSE-INSPECT",
        "CAT-HYD-TECHNICAL-ANALYSIS",
        "ISO-13379-1-2025"
      ],
      "sourceNature": "literatura_geral_sem_efetividade_de_serie",
      "linkedCausalChainId": null,
      "serialOrArrangement": null,
      "sapLocationId": null,
      "confirmedComponentCode": null,
      "caseReview": {
        "engineering": null,
        "independent": null,
        "oem": null,
        "status": "pendente_sem_evidencia"
      },
      "executionStatus": "not_performed",
      "observedEvents": 0,
      "confirmedRootCause": false,
      "approvedForOperationalUse": false
    },
    {
      "id": "DEEP-DR410-FEED-001",
      "playbookId": "PB-DRILL-DR410-FEED-01",
      "sourcePlaybookVersion": "1.2.1",
      "originScenarioStatus": "cenario_autoral_sintetico",
      "system": "avanco_perfuratriz",
      "title": "Perfuratriz DR410i — avanço irregular",
      "modelIds": [
        "EQ05"
      ],
      "objective": "Distinguir geometria e corrente do avanço, restrição de guias e resposta hidráulica ou comando.",
      "hypotheses": [
        {
          "id": "H1",
          "label": "Corrente de avanço com desgaste/tensão inadequada",
          "expectedSigns": "Folga, desgaste ou geometria incompatível com o ajuste especificado",
          "counterSigns": "Corrente inspecionada e medida dentro do limite aplicável"
        },
        {
          "id": "H2",
          "label": "Guiamento ou elementos deslizantes oferecendo resistência",
          "expectedSigns": "Marcas de contato, sujeira ou restrição mecânica em guias",
          "counterSigns": "Guias íntegras e livres após inspeção"
        },
        {
          "id": "H3",
          "label": "Oscilação hidráulica ou de controle do avanço",
          "expectedSigns": "Resposta irregular mesmo sem impedimento mecânico demonstrado",
          "counterSigns": "Comando e circuito se comportam conforme testes OEM"
        }
      ],
      "sourceTestIds": [
        "T1",
        "T2"
      ],
      "stages": [
        {
          "id": "S1",
          "methodId": "EV-01",
          "sourceTestId": "T1",
          "question": "Com mastro travado e energia isolada, existem marcas localizadas, material aprisionado, danos visíveis na corrente ou impedimento das guias?",
          "signals": {
            "H1": "Desgaste e assentamento anormal da corrente ou rodas dentadas favorecem necessidade de investigar tensionamento.",
            "H2": "Marcas de arrasto e acúmulo de material nas guias favorecem resistência mecânica de guiamento.",
            "H3": "Ausência de impedimento visível aumenta a necessidade de avaliar controle, mas não o comprova."
          },
          "nonDiscrimination": "Inspeção sem acesso à trajetória completa, ou com o mastro previamente desmontado, não isola mecanismo inicial.",
          "requiredMetadata": [
            "equipmentContext",
            "dateTime",
            "isolationStatus",
            "mastSupport",
            "inspectionLocation",
            "visualDocumentation"
          ],